[
  {
    "id": "unified-mentor",
    "name": "Unified Mentor",
    "status": "blacklist",
    "category": [
      "internship",
      "training-fee"
    ],
    "linkedinURL": "https://www.linkedin.com/company/unifiedmentor",
    "issue_url": "https://github.com/Un-scam/Un-scam.github.io/issues/5",
    "submittedBy": "vijaysamant4368",
    "dateAdded": "2026-08-31"
  }
]
